"Casa en Venta, Libertador",MC4598488,Libertador,$500.000.000,Entre 0 y 5 años,250 m²,250 m²,2,"En venta! espectacular casa para estrenar con AMPLIOS ESPACIOS y EXCELENTES ACABADOS de 3 niveles. Cuenta con 3 HABITACIONES, 3 baños, parqueadero para 2 vehículos con apertura eléctrica, terraza y balcón en habitación principal, terraza y zona de ropas. UBICADA EN CONJUNTO CERRADO, SECTOR TRANQUILO y RENOVADO de ACTUAL VALORIZACIÓN, SECTOR COLEGIO CALASANZ.",3,3,3,"['Baño auxiliar', 'Características del parqueadero cubierto', 'Citófonos', 'Cocina tipo americano', 'Cocina integral', 'Piso en madera', 'Piso en porcelanato', 'Zona de lavandería', 'Piso 3', 'Patio', 'Tipo de parqueadero propio', 'Conjunto cerrado', 'Cerca colegios / universidades', 'Cerca supermercados', 'Cerca transporte público', 'Zona residencial']","['Baño auxiliar', 'Características del parqueadero cubierto', 'Citófonos', 'Cocina tipo americano', 'Cocina integral', 'Piso en madera', 'Piso en porcelanato', 'Zona de lavandería', 'Piso 3', 'Patio', 'Tipo de parqueadero propio', 'Conjunto cerrado', 'Cerca colegios / universidades', 'Cerca supermercados', 'Cerca transporte público', 'Zona residencial']",0,0,0,1,0,1,1,1,0,0,1,0,0,0,0,0,1,0,0,0,0,0,0,1,0,0,0,0,0,1,0,1,0,0,0,0,0,0,0,0,1,0,0,0,1,0,1,0,1,0,0,1,1,0,0,0,0,0,0,0,1,0,2023-10-03,duitama
"Casa en Venta, Salesiano",MC4587631,Salesiano,$540.000.000,Más de 20 años,210 m²,210 m²,$100.000,Preciosa Casa Remodelada Esquinera interna en Conjunto Cerrado. Excelentes terminados. Pisos y baños en Porcelanato.  Persianas en Madera Pentagrama. Buena iluminación natural. Video Portero. A cinco cuadras de Plaza de los Libertadores. Cerca a Colegios y Centro Comercial Innovo.   ,4,3,3,"['Características del parqueadero descubierto', 'Chimenea', 'Citófonos', 'Cocina integral', 'Estudio o biblioteca', 'Piso en madera', 'Piso en porcelanato', 'Zona de lavandería', 'Piso 2', 'Patio', 'Tipo de parqueadero propio', 'Depósito o cuarto útil', 'Jardín', 'Conjunto cerrado', 'Cerca centros comerciales', 'Cerca colegios / universidades', 'Cerca parques', 'Cerca supermercados', 'Cerca transporte público', 'Zona residencial']","['Características del parqueadero descubierto', 'Chimenea', 'Citófonos', 'Cocina integral', 'Estudio o biblioteca', 'Piso en madera', 'Piso en porcelanato', 'Zona de lavandería', 'Piso 2', 'Patio', 'Tipo de parqueadero propio', 'Depósito o cuarto útil', 'Jardín', 'Conjunto cerrado', 'Cerca centros comerciales', 'Cerca colegios / universidades', 'Cerca parques', 'Cerca supermercados', 'Cerca transporte público', 'Zona residencial']",0,0,1,1,0,1,1,0,0,0,1,0,0,0,0,0,1,0,1,0,0,0,1,0,0,0,1,0,0,1,0,1,1,0,0,0,0,0,0,0,1,0,0,0,0,0,1,0,1,0,0,1,1,0,0,1,1,0,0,0,0,0,2023-10-03,duitama
"Lote o Casalote en Venta, BOCHICA",290-M4451160,BOCHICA,$420.000.000,Entre 0 y 5 años,0 m²,465 m²,,"EXCELENTE LOTE BIEN UBICADO PARA  PROYECTO DE VIVIENDA HASTA 5 PISOS O USO COMERCIAL, INSTITUCIONAL, TIPO I Y II
SE PERMUTA POR VIVIENDA EN BOGOTA BIEN UBICADA",3,,,"['Ancho 24 m', 'Fondo 33.50 m', 'Tipo de lote lote vacío', 'Area lote 465 m²', 'Acceso para discapacitados', 'Cerca centros comerciales', 'Cerca colegios / universidades', 'Cerca parques', 'Cerca supermercados', 'Cerca transporte público', 'Sobre vía secundaria']","['Ancho 24 m', 'Fondo 33.50 m', 'Tipo de lote lote vacío', 'Area lote 465 m²', 'Acceso para discapacitados', 'Cerca centros comerciales', 'Cerca colegios / universidades', 'Cerca parques', 'Cerca supermercados', 'Cerca transporte público', 'Sobre vía secundaria']",0,0,0,0,0,1,1,0,0,0,0,0,0,0,0,0,0,0,0,0,0,0,0,0,0,0,0,0,0,0,0,0,1,0,0,0,0,0,0,0,0,0,1,0,0,1,0,0,0,0,0,0,1,1,0,0,1,0,0,0,0,0,2023-10-03,duitama
"Apartamento en Venta, Vaticano",MC4596732,Vaticano,$170.000.000,Entre 0 y 5 años,67 m²,60 m²,,"Hermoso apartamento para estrenar! Esta ubicado en un sector de alta valorización, a 3 cuadras del centro comercial innovo plaza. Es un sector residencial y muy tranquilo. Consta de 3 habitaciones (2 con closeth) cocina integral (con horno, estufa y extractor de olores) , sala, comedor, zona de ropas, 2 baños. Tercer piso.",3,3,2,"['Cocina tipo americano', 'Cocina integral', 'Piso en porcelanato', 'Piso 3', 'Cerca centros comerciales', 'Cerca colegios / universidades', 'Cerca parques', 'Cerca supermercados', 'Cerca transporte público', 'Ubicado en edificio', 'Zona residencial']","['Cocina tipo americano', 'Cocina integral', 'Piso en porcelanato', 'Piso 3', 'Cerca centros comerciales', 'Cerca colegios / universidades', 'Cerca parques', 'Cerca supermercados', 'Cerca transporte público', 'Ubicado en edificio', 'Zona residencial']",0,1,0,1,0,1,1,0,0,0,0,0,0,0,0,0,0,0,0,0,0,0,0,1,0,0,0,0,0,0,0,0,1,0,0,0,0,0,0,0,1,0,0,0,0,0,1,0,0,0,0,0,1,0,0,0,1,0,0,0,1,0,2023-10-03,duitama
"Casa en Venta, Villa Inés ",MC4559429,Villa Inés ,$480.000.000,Entre 10 y 20 años,277 m²,277 m²,1,"Hermosa casa unifamiliar, cerca a colegios, tres plantas, primer piso: sala con chimenea, garaje,baño auxiliar, jardín interior, comedor, estudio, cocina, cuarto de servicio con baño, patio cubierto con policarbonato. Segundo piso: cuatro habitaciones, la principal con vestier y baño privado, sauna, Star de TV, baño auxiliar. Tercer piso: habitación con terraza, baño, terraza cubierta con policarbonato y zona de BBQ ",3,5,5,"['Características del parqueadero cubierto', 'Chimenea', 'Cocina integral', 'Cuarto de servicio', 'Estudio o biblioteca', 'Piso en baldosa', 'Sauna / turco', 'Zona de lavandería', 'Piso 3', 'Patio', 'Tipo de parqueadero propio', 'Baños de servicio', 'Depósito o cuarto útil', 'Jardín', 'Zona de BBQ', 'Cerca colegios / universidades', 'Cerca parques', 'Cerca supermercados', 'Cerca transporte público', 'Zona residencial']","['Características del parqueadero cubierto', 'Chimenea', 'Cocina integral', 'Cuarto de servicio', 'Estudio o biblioteca', 'Piso en baldosa', 'Sauna / turco', 'Zona de lavandería', 'Piso 3', 'Patio', 'Tipo de parqueadero propio', 'Baños de servicio', 'Depósito o cuarto útil', 'Jardín', 'Zona de BBQ', 'Cerca colegios / universidades', 'Cerca parques', 'Cerca supermercados', 'Cerca transporte público', 'Zona residencial']",0,0,1,1,0,1,1,1,0,0,0,0,1,0,0,0,1,0,1,0,0,1,0,0,0,0,1,0,0,1,0,1,1,0,0,0,0,0,0,0,1,0,0,1,0,0,0,1,0,0,0,0,1,0,0,1,0,0,0,0,1,0,2023-10-03,duitama
"Casa en Venta, Villa Patricia",MC4581016,Villa Patricia,$400.000.000,Más de 20 años,130 m²,130 m²,1,"Esta propiedad está convenientemente ubicada cerca de parques, colegios, tiendas y restaurantes, lo que la convierte en el lugar perfecto para establecer tu hogar.",4,3,3,"['Baño auxiliar', 'Características del parqueadero cubierto', 'Cocina tipo americano', 'Cocina integral', 'Cuarto de servicio', 'Estudio o biblioteca', 'Piso 2', 'Patio', 'Tipo de parqueadero propio', 'Cancha(s) de fútbol', 'Cerca centros comerciales', 'Cerca colegios / universidades', 'Cerca parques', 'Cerca supermercados', 'Zona comercial']","['Baño auxiliar', 'Características del parqueadero cubierto', 'Cocina tipo americano', 'Cocina integral', 'Cuarto de servicio', 'Estudio o biblioteca', 'Piso 2', 'Patio', 'Tipo de parqueadero propio', 'Cancha(s) de fútbol', 'Cerca centros comerciales', 'Cerca colegios / universidades', 'Cerca parques', 'Cerca supermercados', 'Zona comercial']",0,0,0,1,0,1,1,1,0,0,0,0,0,0,0,0,1,0,1,0,0,1,1,1,0,0,0,0,0,0,0,1,1,0,0,0,0,0,0,0,0,1,0,0,1,0,0,0,0,0,0,0,0,0,0,0,1,0,0,0,0,0,2023-10-03,duitama
"Casa en Venta, Cerro pino",MC4533433,Cerro pino,$130.000.000,Entre 10 y 20 años,70 m²,82 m²,,¿SE VENDE CASA SUPER ECONÓMICA EN DUITAMA ¿ ¿ Barrió cerró pino ¿SE RECIBE SUBSIDIO CAJA HONOR ¿  ¿Cuenta con jardín ¿  PRIMER NIVEL sola comedor Una habitación Cocina semi integral Patio de ropas Un baño SEGUNDO NÍVEL  2 habitaciones un baño,2,3,2,"['Piso en baldosa', 'Piso 2', 'Patio', 'Jardín', 'Cancha(s) de fútbol', 'Zonas verdes', 'Cerca parques', 'Cerca transporte público', 'Zona residencial']","['Piso en baldosa', 'Piso 2', 'Patio', 'Jardín', 'Cancha(s) de fútbol', 'Zonas verdes', 'Cerca parques', 'Cerca transporte público', 'Zona residencial']",0,0,0,0,0,0,0,0,0,0,0,0,1,0,1,0,1,0,0,0,0,0,1,0,0,0,1,0,0,0,0,0,1,0,0,0,0,0,0,0,1,0,0,0,0,0,0,0,0,0,0,0,1,0,0,0,0,0,0,0,0,0,2023-10-03,duitama
"Lote o Casalote en Venta, Duitama",34-M4239598,Duitama,$1.003.520.000,Más de 20 años,1024 m²,1024 m²,,"Excelente predio ubicado en la ciudad de Duitama, Boyaca. a dos cuadras de la via principal de facil acceso y ubicado en barrio con proyectos de construccion urbana. ",3,,,"['Ancho 1.0 m', 'Area lote 1024 m²']","['Ancho 1.0 m', 'Area lote 1024 m²']",0,0,0,0,0,0,0,0,0,0,0,0,0,0,0,0,0,0,0,0,0,0,0,0,0,0,0,0,0,0,0,0,0,0,0,0,0,0,0,0,0,0,0,0,0,0,0,0,0,0,0,0,0,0,0,0,0,0,0,0,0,0,2023-10-03,duitama
"Oficina en Venta, Centro",MC4567457,centro,$265.000.000,Entre 0 y 5 años,50 m²,49 m²,$166.234,"Venta de espectacular oficina - consultorio con baño privado y cuarto de aseo-deposito, ubicada en el centro empresarial Durdan. El edificio cuenta con sala de juntas, amplia recepcion y vigilancia. El precio publicado corresponde al inmueble sin parqueadero. El parqueadero tiene un valor de 35 millones de pesos",1,,1,"['Citófonos', 'Piso en porcelanato', 'Piso 3', 'Tipo de parqueadero propio', 'Ascensor', 'Baños públicos', 'Parqueadero visitantes', 'Portería', 'Cerca centros comerciales', 'Cerca colegios / universidades', 'Cerca supermercados', 'Cerca transporte público', 'Ubicado en edificio', 'Zona comercial']","['Citófonos', 'Piso en porcelanato', 'Piso 3', 'Tipo de parqueadero propio', 'Ascensor', 'Baños públicos', 'Parqueadero visitantes', 'Portería', 'Cerca centros comerciales', 'Cerca colegios / universidades', 'Cerca supermercados', 'Cerca transporte público', 'Ubicado en edificio', 'Zona comercial']",0,1,0,0,0,1,1,0,1,0,1,0,0,0,0,1,0,0,0,0,0,0,0,0,0,0,0,0,0,0,0,1,0,0,0,0,0,0,0,0,0,1,0,0,0,0,1,0,0,0,0,0,1,0,1,0,1,0,0,0,1,0,2023-10-03,duitama
"Lote o Casalote en Venta, Vereda Tocogua Duitama",10278-M3848739,Vereda Tocogua Duitama,$350.000.000,Entre 10 y 20 años,0 m²,0 m²,,"Este lote ubicado en la Vereda Tocogüa, cuenta con un tanque de agua de reserva y con posibilidad de habilitar un punto de Luz  energía eléctrica . Cuenta con los beneficios de la paz y tranquilidad que da una ubicación rural o campestre, pero muy cerca del casco urbano del municipio de Duitama, una de las principales poblaciones del departamento de Boyacá. La ubicación del predio es estratégica ya que cuenta con una hermosa vista y se encuentra muy cerca de senderos naturales para realizar caminatas ecológicas o actividades de ecoturismo. La distancia entre la entrada al lote y la primera vía urbana es aproximadamente menos de 1 kilometro o lo que equivale a menos de 5 minutos en un vehículo particular o 15 minutos caminando.",2,,,[],[],0,0,0,0,0,0,0,0,0,0,0,0,0,0,0,0,0,0,0,0,0,0,0,0,0,0,0,0,0,0,0,0,0,0,0,0,0,0,0,0,0,0,0,0,0,0,0,0,0,0,0,0,0,0,0,0,0,0,0,0,0,0,2023-10-03,duitama
"Lote o Casalote en Venta, Camilo torres",3284-M2848162,Camilo torres,$10.000.400.600,Más de 20 años,2000 m²,12950 m²,,"La propiedad es un lote esquinero, cuenta con tres frentes en vías urbanas, entre las cuales se encuentra la transversal 20. La topografía de la propiedad es típica del sector y es apta para un desarrollo residencial. La misma cuenta con servicios disponibles para su uso, tiene una topografía en términos generales plana y no se encuentra en zona de inundación.",3,,,"['Ancho 178 m', 'Fondo 136 m', 'Tipo de lote lote vacío', 'Area lote 12950 m²', 'Esquinero', 'Cerca colegios / universidades', 'Cerca transporte público', 'Sobre vía principal']","['Ancho 178 m', 'Fondo 136 m', 'Tipo de lote lote vacío', 'Area lote 12950 m²', 'Esquinero', 'Cerca colegios / universidades', 'Cerca transporte público', 'Sobre vía principal']",0,0,0,0,0,1,0,0,0,0,0,0,0,0,0,0,0,0,0,0,0,0,0,0,0,1,0,0,0,0,0,0,0,0,0,0,0,0,0,0,0,0,0,0,0,1,0,0,0,0,0,0,1,0,0,0,0,0,0,0,0,0,2023-10-03,duitama
"Casa en Venta, Av Las Américas",11295-M3581012,Av Las Américas,$753.228.915,Más de 20 años,465 m²,465 m²,,"En venta, una amplia casa de 3 niveles con mezanine y ascensor industrial, ubicada sobre la transitada Avenida Las Américas, en un sector comercial de alto tráfico vehicular y peatonal. La propiedad cuenta con todos los servicios, luz trifásica y una excelente iluminación. En el primer nivel, hay un área de atención al cliente con una oficina, un punto de servicio, ascensor y baño. En el segundo nivel, se encuentra un mezanine con otra oficina y baño. En el tercer nivel, hay un amplio espacio para inventario y en el último nivel, un apartamento de 3 habitaciones con closet, 2 baños, cocina, patio de ropas y un luminoso espacio con vista a la avenida. La propiedad se encuentra a 5 minutos del centro, la funeraria y en un sector comercial con restaurantes, tiendas de autos, papelerías y supermercados ARA. Contáctanos para más información y programar una visita.",3,3,3,"['Zona de lavandería', 'Tipo de casa tradicional']","['Zona de lavandería', 'Tipo de casa tradicional']",0,0,0,0,0,0,0,0,0,0,0,0,0,0,0,0,0,0,0,0,0,0,0,0,0,0,0,0,0,1,0,0,0,0,1,0,0,0,0,0,0,0,0,0,0,0,0,0,0,0,0,0,0,0,0,0,0,0,0,0,0,0,2023-10-03,duitama
"Apartamento en Venta, Libertador ",MC4559592,Libertador ,$265.000.000,Entre 0 y 5 años,88 m²,90 m²,1,¿SE VENDE EXCLUSIVOS APARTAMENTOS CERCA A INNOVO¿  ¿Apartamento de ochenta y ocho mtr parqueadero   deposito $doscientos sesenta y cinco¿ Apartamento noventa y seis mtr   parqueadero deposito $285&#39;  ¿SE RECIBE SUBSIDIO CAJA HONOR Y CRÉDITO HIPOTECARIO ¿  ¿Tres habitaciones con closet ¿Dos baños con division en vidrio ¿ Estudio ¿Cocina integral ¿Zona humedad ¿Sala comedor ¿ Tanque subterráneo ,3,3,2,"['Baño auxiliar', 'Características del parqueadero cubierto', 'Cocina integral', 'Estudio o biblioteca', 'Zona de lavandería', 'Piso 5', 'Tipo de parqueadero propio', 'Depósito o cuarto útil', 'Cerca centros comerciales', 'Cerca colegios / universidades', 'Cerca parques', 'Cerca supermercados', 'Cerca transporte público', 'Ubicado en edificio', 'Zona comercial', 'Zona residencial']","['Baño auxiliar', 'Características del parqueadero cubierto', 'Cocina integral', 'Estudio o biblioteca', 'Zona de lavandería', 'Piso 5', 'Tipo de parqueadero propio', 'Depósito o cuarto útil', 'Cerca centros comerciales', 'Cerca colegios / universidades', 'Cerca parques', 'Cerca supermercados', 'Cerca transporte público', 'Ubicado en edificio', 'Zona comercial', 'Zona residencial']",0,1,0,1,0,1,1,1,0,0,0,0,0,0,0,0,0,0,1,0,0,0,0,0,0,0,0,0,0,1,0,1,1,0,0,0,0,0,0,0,1,1,0,0,1,0,0,0,0,0,0,0,1,0,0,1,1,0,0,0,0,0,2023-10-03,duitama
"Lote o Casalote en Venta, Colombia",MC4601064,colombia,$80.000.000,2373 m²,2373 m²,,,"Lote Rural en la vereda La Parroquia del Municipio de Duitama ubicado subiendo por la calle 14 pasando el Colegio Seminario La iglesia del Divino Niño y el paradero de buses , tiene aljibe propio y es tierra virgen para sembrar, también se puede construir y tiene contador de agua y poste de luz al lado para solicitar los servicios al Municipio, escriba al Whatsapp Tres Diez, Tres cincuenta y cuatro, Treinta y dos, Treinta y cinco para envío de video",3,,,"['Fondo 12 m', 'Lote vacio', 'Piso 1', 'Linda con rio o quebrada']","['Fondo 12 m', 'Lote vacio', 'Piso 1', 'Linda con rio o quebrada']",0,0,0,0,0,0,0,0,0,0,0,0,0,0,0,0,0,0,0,0,0,0,0,0,1,0,0,0,0,0,0,0,0,0,0,0,0,1,0,0,0,0,0,0,0,0,0,0,0,0,0,0,0,0,0,0,0,0,0,0,0,0,2023-10-03,duitama
"Casa en Venta, Solano",10278-311065182,Solano,$735.000.000,Más de 20 años,234 m²,210 m²,1,"Casa esquinera en el barrio Solano de Duitama. Predio de tres niveles, con 5 habitaciones, 2 baños, baño social, habitación y baño de servicio, sala con chimenea, comedor, cocina, patio de ropas, estudio, garaje y antejardín. Esta casa se encuentra ubicada en un importante y dinámico sector de la cuidad, frente al parque Solano y en la zona de influencia de los Centros Comerciales Innovo y Solano.",4,5,2,"['Baño auxiliar', 'Cuarto de servicio', 'Estudio o biblioteca', 'Parqueadero cubierto', 'Instalación de gas natural', 'Tipo de cocina lineal', 'Tipo de comedor sala comedor', 'Tipo de parqueadero independiente', 'Tipo acabado de piso otro', 'Tipo de piso en alcobas otro', 'Tipo de piso en comedor otro', 'Tipo de piso en estudio otro', 'Tipo de piso en sala otro', 'Baños de servicio', 'Jardín', 'Vigilancia 0', 'Cerca centros comerciales', 'Cerca parques', 'Cerca supermercados', 'Cerca transporte público']","['Baño auxiliar', 'Cuarto de servicio', 'Estudio o biblioteca', 'Parqueadero cubierto', 'Instalación de gas natural', 'Tipo de cocina lineal', 'Tipo de comedor sala comedor', 'Tipo de parqueadero independiente', 'Tipo acabado de piso otro', 'Tipo de piso en alcobas otro', 'Tipo de piso en comedor otro', 'Tipo de piso en estudio otro', 'Tipo de piso en sala otro', 'Baños de servicio', 'Jardín', 'Vigilancia 0', 'Cerca centros comerciales', 'Cerca parques', 'Cerca supermercados', 'Cerca transporte público']",0,0,0,0,1,0,1,0,0,0,0,0,0,1,0,0,0,0,1,0,0,1,0,0,0,0,1,1,0,0,1,0,1,0,0,0,0,0,0,0,0,0,0,0,1,0,0,1,0,0,0,0,1,0,0,0,1,1,1,0,0,0,2023-10-03,duitama
"Casa en Venta, LA FLORESTA",11295-M4050790,LA FLORESTA,$350.000.000,Entre 10 y 20 años,230 m²,230 m²,3,"Se vende casa ubicada en un sector central cerca a la Clínica Boyacá, la Universidad Antonio Nariño, Supermercado Paraíso y a 3 minutos del Nuevo Terminal además cerca a la Av las Américas y a conjuntos exclusivos como el Club de la floresta, La propiedad consta de 6 habitaciones, 3 baños, uno en la habitación principal y 2 sociales, sala comedor, cocina integral con horno, zona de estar y una terraza amplia con una zona social adicionalmente un garaje extenso para 3 garajes",4,5,3,"['Zona de lavandería', 'Tipo de casa tradicional']","['Zona de lavandería', 'Tipo de casa tradicional']",0,0,0,0,0,0,0,0,0,0,0,0,0,0,0,0,0,0,0,0,0,0,0,0,0,0,0,0,0,1,0,0,0,0,1,0,0,0,0,0,0,0,0,0,0,0,0,0,0,0,0,0,0,0,0,0,0,0,0,0,0,0,2023-10-03,duitama
"Casa en Venta, Altos de Surba y Bonza",MC4438277,Altos de Surba y Bonza,$1.234.567,Entre 0 y 5 años,350 m²,10 m²,3,Vendo hermosa casa en condominio Altos de Surba y Bonza. Duitama. Boyacá. Para valor y mas información favor llamar. Trescientos cuatro 453 treintainueve 89,5,3,4,"['Baño auxiliar', 'Características del parqueadero cubierto', 'Chimenea', 'Cocina tipo americano', 'Cocina integral', 'Estudio o biblioteca', 'Vigilancia', 'Zona de lavandería', 'Piso 2', 'Patio', 'Tipo de parqueadero propio', 'Baños de servicio', 'Depósito o cuarto útil', 'Jardín', 'Parqueadero visitantes', 'Conjunto cerrado', 'Portería', 'Cancha(s) de fútbol', 'Cancha(s) de tennis', 'Salón comunal', 'Zona de BBQ', 'Zona para niños', 'Zonas verdes', 'Cerca colegios / universidades', 'Cerca transporte público', 'Zona campestre', 'Zona residencial']","['Baño auxiliar', 'Características del parqueadero cubierto', 'Chimenea', 'Cocina tipo americano', 'Cocina integral', 'Estudio o biblioteca', 'Vigilancia', 'Zona de lavandería', 'Piso 2', 'Patio', 'Tipo de parqueadero propio', 'Baños de servicio', 'Depósito o cuarto útil', 'Jardín', 'Parqueadero visitantes', 'Conjunto cerrado', 'Portería', 'Cancha(s) de fútbol', 'Cancha(s) de tennis', 'Salón comunal', 'Zona de BBQ', 'Zona para niños', 'Zonas verdes', 'Cerca colegios / universidades', 'Cerca transporte público', 'Zona campestre', 'Zona residencial']",0,0,1,1,0,1,0,1,1,0,0,0,0,1,1,1,1,0,1,0,0,0,1,1,0,0,1,0,1,1,0,1,0,0,0,0,1,0,1,0,1,0,0,1,1,0,0,1,0,0,0,1,1,0,0,1,0,0,0,0,0,0,2023-10-03,duitama
"Apartamento en Venta, Conjunto Residencial El Parque",MC4520358,Conjunto Residencial El Parque,$480.000.000,Más de 20 años,261 m²,261 m²,2,"Penthouse Duplex  Ganga en Conjunto Cerrado 5to piso. 261.M Estrato 4 Centro de Duitama Boyacá. Cerca a bancos,centros comerciales, colegios, a dos cuadras de la Plaza de los Libertadores. Sala, comedor, estudio, hall de tv, tres amplias habitaciones, tres baños incluido  baño social y servicio, vestier, cocina integral, lavandería, terraza, parqueadero cubierto para dos automóviles, bodega y gas natural. Areas verdes, parque infantil, portería, vigilancia, cctv, reserva y bomba de agua.",4,3,3,"['Características del parqueadero cubierto', 'Citófonos', 'Cocina integral', 'Estudio o biblioteca', 'Piso en alfombra', 'Piso en madera', 'Vigilancia', 'Zona de lavandería', 'Piso 5', 'Tipo de parqueadero propio', 'Zona para niños', 'Zonas verdes', 'Cerca centros comerciales', 'Cerca colegios / universidades', 'Cerca parques', 'Cerca supermercados', 'Cerca transporte público', 'Zona residencial']","['Características del parqueadero cubierto', 'Citófonos', 'Cocina integral', 'Estudio o biblioteca', 'Piso en alfombra', 'Piso en madera', 'Vigilancia', 'Zona de lavandería', 'Piso 5', 'Tipo de parqueadero propio', 'Zona para niños', 'Zonas verdes', 'Cerca centros comerciales', 'Cerca colegios / universidades', 'Cerca parques', 'Cerca supermercados', 'Cerca transporte público', 'Zona residencial']",0,0,0,1,0,1,1,1,0,0,1,0,0,1,1,0,0,0,1,0,0,0,0,0,0,0,0,0,1,1,0,1,1,0,0,0,0,0,0,0,1,0,0,0,0,0,0,0,1,0,0,0,1,0,0,0,1,0,0,0,0,0,2023-10-03,duitama
"Casa en Venta, SAN JUAN BOSCO",MC4568594,SAN JUAN BOSCO,$650.000.000,Más de 20 años,224 m²,224 m²,,"Casa De 2 Pisos Y Terraza Con 4 Apartamentos Independientes,  cada uno cuenta con 2 habitaciones, baño  y cocina independiente. Adicionalmente el apartamento del primer piso cuenta con un patio individual",3,5,4,"['Cocina integral', 'Piso en baldosa', 'Piso 2', 'Patio', 'Vivienda bifamiliar', 'Cerca centros comerciales', 'Cerca colegios / universidades', 'Cerca parques', 'Cerca supermercados', 'Cerca transporte público', 'Zona campestre', 'Zona comercial', 'Zona residencial']","['Cocina integral', 'Piso en baldosa', 'Piso 2', 'Patio', 'Vivienda bifamiliar', 'Cerca centros comerciales', 'Cerca colegios / universidades', 'Cerca parques', 'Cerca supermercados', 'Cerca transporte público', 'Zona campestre', 'Zona comercial', 'Zona residencial']",0,0,0,1,0,1,1,0,0,0,0,0,1,0,0,0,1,0,0,0,0,0,1,0,0,0,0,0,0,0,0,0,1,0,0,0,0,0,1,0,1,1,0,0,0,0,0,0,0,0,0,0,1,0,0,0,1,0,0,0,0,0,2023-10-03,duitama
"Casa en Venta, EL PROGRESO",11295-M3798074,EL PROGRESO,$280.000.000,Entre 5 y 10 años,307 m²,307 m²,,"Casa de 4 plantas unifamiliar en obra gris con materiales de primera calidad con 6 habitaciones 3 baños, sala comedor, cocina, plancha con una excelente vista a la ciudad, el sector es residencial cerca  a zona comercial fácil transporte publico los principales colegios y a conjuntos residenciales",2,5,3,"['Zona de lavandería', 'Tipo de casa tradicional']","['Zona de lavandería', 'Tipo de casa tradicional']",0,0,0,0,0,0,0,0,0,0,0,0,0,0,0,0,0,0,0,0,0,0,0,0,0,0,0,0,0,1,0,0,0,0,1,0,0,0,0,0,0,0,0,0,0,0,0,0,0,0,0,0,0,0,0,0,0,0,0,0,0,0,2023-10-03,duitama
"Local Comercial en Venta, Solano",10278-M4039828,Solano,$310.000.000,Entre 0 y 5 años,21.87 m²,21.87 m²,,"Se vende local comercial esquinero nuevo, con un área de 21,87m2 más un parqueadero. El local se encuentra ubicado en la entrada 3 del pasaje Comercial Solano Actualmente el local se encuentra rentando con la posibilidad de cesión de contrato.
El pasaje Comercial Solano se encuentra ubicado a unos pasos del centro comercial Innovo, el cuál cuenta con 2 niveles más un semisótano para parqueo de vehículos y depósitos. El primer nivel cuenta con locales comerciales con áreas entre 10 y 28 m2 aproximadamente, islas comerciales con áreas promedio de 4 m2 y zona para cafés. El tercer nivel cuenta con un local de gran formato destinado para salas de cine, un casino, 33 islas desde 4 m2, 5 locales para comida con plazoleta y 21 locales comerciales entre los 10 y 26 m2.
Es una excelente oportunidad de inversión con buena rentabilidad.
",5,,,"['Número de local 1', 'Piso 1', 'Tipo de local en centro comercial', 'Vista exterior', 'Ascensor', 'Circuito cerrado de TV', 'Número de Ascensores 1', 'Vigilancia 24hrs', 'Cerca centros comerciales', 'Cerca parques', 'Cerca supermercados', 'Cerca transporte público', 'Sobre vía principal']","['Número de local 1', 'Piso 1', 'Tipo de local en centro comercial', 'Vista exterior', 'Ascensor', 'Circuito cerrado de TV', 'Número de Ascensores 1', 'Vigilancia 24hrs', 'Cerca centros comerciales', 'Cerca parques', 'Cerca supermercados', 'Cerca transporte público', 'Sobre vía principal']",1,0,0,0,0,0,1,0,0,0,0,0,0,1,0,0,0,0,0,0,0,0,0,0,0,1,0,0,0,0,0,0,1,0,0,0,0,1,0,1,0,0,0,0,0,0,0,0,0,0,0,0,1,0,1,0,1,0,0,1,0,1,2023-10-03,duitama
"Lote o Casalote en Venta, Centro",MC4599693,centro,$6.075.000.000,0 m²,675 m²,,,"Lote en exclusivo sector centro, a menos de cinco minutos de La Plaza de los libertadores.  30 Mt Fondo x 22.5 Mt frente. ",4,,,"['Fondo 30 m', 'Lote vacio', 'Piso 0', 'Cerca transporte público']","['Fondo 30 m', 'Lote vacio', 'Piso 0', 'Cerca transporte público']",0,0,0,0,0,0,0,0,0,0,0,0,0,0,0,0,0,0,0,0,0,0,0,0,1,0,0,0,0,0,0,0,0,0,0,0,0,0,0,0,0,0,0,0,0,0,0,0,0,0,0,0,1,0,0,0,0,0,0,0,0,0,2023-10-03,duitama
